{
  "schema": "https://bukit.dev/schemas/seo-report.v1.json",
  "schemaVersion": "1.0",
  "generatedAt": "2026-05-30T13:52:10.7786+00:00",
  "siteName": "i18n-test",
  "siteUrl": "https://example.com",
  "baseUrl": "/",
  "routes": [
    {
      "url": "/en/",
      "outputPath": "en/index.html",
      "title": "I18N Test",
      "description": "Browse 1 content items from I18N Test.",
      "canonical": "https://example.com/en/",
      "robots": null,
      "indexable": true,
      "lastModified": "2026-05-30T13:52:10.65243+00:00",
      "contentType": "list",
      "sourceItemId": null,
      "sitemapIncluded": false,
      "searchIncluded": false,
      "rssIncluded": false,
      "alternates": [
        {
          "hreflang": "x-default",
          "href": "https://example.com/en/"
        },
        {
          "hreflang": "en",
          "href": "https://example.com/en/"
        },
        {
          "hreflang": "zh-CN",
          "href": "https://example.com/zh-CN/"
        }
      ],
      "schemaTypes": [
        "SearchAction",
        "WebPage",
        "WebSite"
      ]
    },
    {
      "url": "/en/index/",
      "outputPath": "en/index/index.html",
      "title": "English Page",
      "description": null,
      "canonical": "https://example.com/en/index/",
      "robots": null,
      "indexable": true,
      "lastModified": "2026-05-30T13:36:05.5889817+00:00",
      "contentType": "page",
      "sourceItemId": "index",
      "sitemapIncluded": false,
      "searchIncluded": false,
      "rssIncluded": false,
      "alternates": [
        {
          "hreflang": "x-default",
          "href": "https://example.com/en/index/"
        },
        {
          "hreflang": "en",
          "href": "https://example.com/en/index/"
        },
        {
          "hreflang": "zh-CN",
          "href": "https://example.com/zh-CN/index/"
        }
      ],
      "schemaTypes": [
        "BreadcrumbList",
        "ListItem",
        "SearchAction",
        "WebPage",
        "WebSite"
      ]
    },
    {
      "url": "/zh-CN/",
      "outputPath": "zh-CN/index.html",
      "title": "I18N Test",
      "description": "Browse 1 content items from I18N Test.",
      "canonical": "https://example.com/zh-CN/",
      "robots": null,
      "indexable": true,
      "lastModified": "2026-05-30T13:52:10.774266+00:00",
      "contentType": "list",
      "sourceItemId": null,
      "sitemapIncluded": false,
      "searchIncluded": false,
      "rssIncluded": false,
      "alternates": [
        {
          "hreflang": "x-default",
          "href": "https://example.com/en/"
        },
        {
          "hreflang": "en",
          "href": "https://example.com/en/"
        },
        {
          "hreflang": "zh-CN",
          "href": "https://example.com/zh-CN/"
        }
      ],
      "schemaTypes": [
        "SearchAction",
        "WebPage",
        "WebSite"
      ]
    },
    {
      "url": "/zh-CN/index/",
      "outputPath": "zh-CN/index/index.html",
      "title": "Chinese Page",
      "description": null,
      "canonical": "https://example.com/zh-CN/index/",
      "robots": null,
      "indexable": true,
      "lastModified": "2026-05-30T13:36:06.5009313+00:00",
      "contentType": "page",
      "sourceItemId": "index",
      "sitemapIncluded": false,
      "searchIncluded": false,
      "rssIncluded": false,
      "alternates": [
        {
          "hreflang": "x-default",
          "href": "https://example.com/en/index/"
        },
        {
          "hreflang": "en",
          "href": "https://example.com/en/index/"
        },
        {
          "hreflang": "zh-CN",
          "href": "https://example.com/zh-CN/index/"
        }
      ],
      "schemaTypes": [
        "BreadcrumbList",
        "ListItem",
        "SearchAction",
        "WebPage",
        "WebSite"
      ]
    }
  ],
  "issues": [
    {
      "severity": "warning",
      "code": "seo.description_missing",
      "route": "/en/index/",
      "message": "SEO description is missing."
    },
    {
      "severity": "warning",
      "code": "seo.description_missing",
      "route": "/zh-CN/index/",
      "message": "SEO description is missing."
    }
  ],
  "summary": {
    "routeCount": 4,
    "indexableCount": 4,
    "nonIndexableCount": 0,
    "errorCount": 0,
    "warningCount": 2,
    "llmsTxtGenerated": false,
    "llmsFullTxtGenerated": false,
    "geoEnhancedCount": 0,
    "geoScore": 0
  }
}
