{
  "schema": "https://bukit.dev/schemas/seo-report.v1.json",
  "schemaVersion": "1.0",
  "generatedAt": "2026-05-30T13:52:15.355637+00:00",
  "siteName": "taxonomy-test",
  "siteUrl": "https://example.com",
  "baseUrl": "/",
  "routes": [
    {
      "url": "/",
      "outputPath": "index.html",
      "title": "Taxonomy Test",
      "description": "Browse 6 content items from Taxonomy Test.",
      "canonical": "https://example.com/",
      "robots": null,
      "indexable": true,
      "lastModified": "2026-05-30T13:52:15.237807+00:00",
      "contentType": "list",
      "sourceItemId": null,
      "sitemapIncluded": true,
      "searchIncluded": true,
      "rssIncluded": false,
      "alternates": [],
      "schemaTypes": [
        "SearchAction",
        "WebPage",
        "WebSite"
      ]
    },
    {
      "url": "/another-post/",
      "outputPath": "another-post/index.html",
      "title": "Another Post",
      "description": null,
      "canonical": "https://example.com/another-post/",
      "robots": null,
      "indexable": true,
      "lastModified": "2026-05-30T13:36:09.1009239+00:00",
      "contentType": "page",
      "sourceItemId": "another-post",
      "sitemapIncluded": true,
      "searchIncluded": true,
      "rssIncluded": false,
      "alternates": [],
      "schemaTypes": [
        "BreadcrumbList",
        "ListItem",
        "SearchAction",
        "WebPage",
        "WebSite"
      ]
    },
    {
      "url": "/categories/",
      "outputPath": "categories/index.html",
      "title": "Categories",
      "description": "Browse all categories.",
      "canonical": "https://example.com/categories/",
      "robots": null,
      "indexable": true,
      "lastModified": "2026-05-30T13:52:15.216808+00:00",
      "contentType": "page",
      "sourceItemId": "categories-index",
      "sitemapIncluded": true,
      "searchIncluded": false,
      "rssIncluded": false,
      "alternates": [],
      "schemaTypes": [
        "BreadcrumbList",
        "CollectionPage",
        "ItemList",
        "ListItem",
        "SearchAction",
        "WebSite"
      ]
    },
    {
      "url": "/categories/blog/",
      "outputPath": "categories/blog/index.html",
      "title": "Category: blog",
      "description": "Browse 1 content items in blog.",
      "canonical": "https://example.com/categories/blog/",
      "robots": null,
      "indexable": true,
      "lastModified": "2026-05-30T13:36:07.8984503+00:00",
      "contentType": "page",
      "sourceItemId": "categories-blog",
      "sitemapIncluded": true,
      "searchIncluded": false,
      "rssIncluded": false,
      "alternates": [],
      "schemaTypes": [
        "BreadcrumbList",
        "CollectionPage",
        "ItemList",
        "ListItem",
        "SearchAction",
        "WebSite"
      ]
    },
    {
      "url": "/categories/news/",
      "outputPath": "categories/news/index.html",
      "title": "Category: news",
      "description": "Browse 1 content items in news.",
      "canonical": "https://example.com/categories/news/",
      "robots": null,
      "indexable": true,
      "lastModified": "2026-05-30T13:36:09.1009239+00:00",
      "contentType": "page",
      "sourceItemId": "categories-news",
      "sitemapIncluded": true,
      "searchIncluded": false,
      "rssIncluded": false,
      "alternates": [],
      "schemaTypes": [
        "BreadcrumbList",
        "CollectionPage",
        "ItemList",
        "ListItem",
        "SearchAction",
        "WebSite"
      ]
    },
    {
      "url": "/categories/tech/",
      "outputPath": "categories/tech/index.html",
      "title": "Category: tech",
      "description": "Browse 1 content items in tech.",
      "canonical": "https://example.com/categories/tech/",
      "robots": null,
      "indexable": true,
      "lastModified": "2026-05-30T13:36:07.8984503+00:00",
      "contentType": "page",
      "sourceItemId": "categories-tech",
      "sitemapIncluded": true,
      "searchIncluded": false,
      "rssIncluded": false,
      "alternates": [],
      "schemaTypes": [
        "BreadcrumbList",
        "CollectionPage",
        "ItemList",
        "ListItem",
        "SearchAction",
        "WebSite"
      ]
    },
    {
      "url": "/index/",
      "outputPath": "index/index.html",
      "title": "Taxonomy Test",
      "description": null,
      "canonical": "https://example.com/index/",
      "robots": null,
      "indexable": true,
      "lastModified": "2026-05-30T13:36:07.8984503+00:00",
      "contentType": "page",
      "sourceItemId": "index",
      "sitemapIncluded": true,
      "searchIncluded": true,
      "rssIncluded": false,
      "alternates": [],
      "schemaTypes": [
        "BreadcrumbList",
        "ListItem",
        "SearchAction",
        "WebPage",
        "WebSite"
      ]
    }
  ],
  "issues": [
    {
      "severity": "warning",
      "code": "seo.title_duplicate",
      "route": "/",
      "message": "SEO title is duplicated by 2 routes."
    },
    {
      "severity": "warning",
      "code": "seo.description_missing",
      "route": "/another-post/",
      "message": "SEO description is missing."
    },
    {
      "severity": "warning",
      "code": "seo.description_missing",
      "route": "/index/",
      "message": "SEO description is missing."
    },
    {
      "severity": "warning",
      "code": "seo.title_duplicate",
      "route": "/index/",
      "message": "SEO title is duplicated by 2 routes."
    }
  ],
  "summary": {
    "routeCount": 7,
    "indexableCount": 7,
    "nonIndexableCount": 0,
    "errorCount": 0,
    "warningCount": 4,
    "llmsTxtGenerated": true,
    "llmsFullTxtGenerated": false,
    "geoEnhancedCount": 0,
    "geoScore": 25
  }
}
